{
  "$schema": "https://json-schema.org/draft/2020-12/schema",
  "$id": "https://example.local/schemas/channel-dna-1.0.0.json",
  "title": "Channel DNA v1",
  "type": "object",
  "additionalProperties": true,
  "required": [
    "schema_family",
    "schema_version",
    "content_version",
    "channel_id",
    "capabilities"
  ],
  "properties": {
    "$schema": {
      "type": "string"
    },
    "schema_family": {
      "const": "channel-dna"
    },
    "schema_version": {
      "$ref": "#/$defs/semanticVersion"
    },
    "content_version": {
      "$ref": "#/$defs/semanticVersion"
    },
    "channel_id": {
      "type": "string",
      "pattern": "^[A-Z][A-Z0-9_]*$"
    },
    "identity": {
      "type": "object"
    },
    "capabilities": {
      "type": "object",
      "additionalProperties": true,
      "properties": {
        "GENRE_POLICY": {
          "$ref": "#/$defs/genrePolicy"
        },
        "TONE_POLICY": {
          "$ref": "#/$defs/tonePolicy"
        },
        "PRESENTATION_POLICY": {
          "$ref": "#/$defs/presentationPolicy"
        },
        "AUDIENCE_CONTRACT": {
          "$ref": "#/$defs/audienceContract"
        },
        "STORY_VARIATION_POLICY": {
          "$ref": "#/$defs/storyVariationPolicy"
        },
        "NARRATION_POLICY": {
          "$ref": "#/$defs/narrationPolicy"
        },
        "REACTION_POLICY": {
          "$ref": "#/$defs/reactionPolicy"
        },
        "HUMOR_POLICY": {
          "$ref": "#/$defs/genericPolicy"
        },
        "VISUAL_POLICY": {
          "$ref": "#/$defs/genericPolicy"
        },
        "PACING_POLICY": {
          "$ref": "#/$defs/genericPolicy"
        },
        "RETENTION_POLICY": {
          "$ref": "#/$defs/genericPolicy"
        },
        "HOST_POLICY": {
          "$ref": "#/$defs/genericPolicy"
        },
        "MUSIC_POLICY": {
          "$ref": "#/$defs/genericPolicy"
        },
        "THUMBNAIL_POLICY": {
          "$ref": "#/$defs/genericPolicy"
        },
        "CRIME_PSYCHOLOGY_POLICY": {
          "$ref": "#/$defs/crimePsychologyPolicy"
        },
        "TRUST_AND_SAFETY_BETRAYAL_POLICY": {
          "$ref": "#/$defs/trustAndSafetyBetrayalPolicy"
        },
        "COERCIVE_CONTROL_POLICY": {
          "$ref": "#/$defs/coerciveControlPolicy"
        },
        "VICTIM_CENTERED_POLICY": {
          "$ref": "#/$defs/victimCenteredPolicy"
        },
        "EXPERT_ANALYSIS_POLICY": {
          "$ref": "#/$defs/expertAnalysisPolicy"
        },
        "RISK_SIGNAL_AND_PUBLIC_VALUE_POLICY": {
          "$ref": "#/$defs/riskSignalAndPublicValuePolicy"
        },
        "SOURCE_DISCLOSURE_POLICY": {
          "$ref": "#/$defs/sourceDisclosurePolicy"
        },
        "CLINICAL_LABEL_POLICY": {
          "$ref": "#/$defs/clinicalLabelPolicy"
        },
        "EPISODE_THEME_POLICY": {
          "$ref": "#/$defs/episodeThemePolicy"
        },
        "SCENE_REALIZATION_POLICY": {
          "$ref": "#/$defs/sceneRealizationPolicy"
        },
        "EXPLICIT_CRIME_EVENT_POLICY": {
          "$ref": "#/$defs/explicitCrimeEventPolicy"
        }
      }
    }
  },
  "$defs": {
    "semanticVersion": {
      "type": "string",
      "pattern": "^[0-9]+\\.[0-9]+\\.[0-9]+$"
    },
    "enumList": {
      "type": "array",
      "minItems": 1,
      "uniqueItems": true,
      "items": {
        "type": "string",
        "pattern": "^[A-Z][A-Z0-9_]*$"
      }
    },
    "genrePolicy": {
      "type": "object",
      "additionalProperties": true,
      "required": ["allowed_genres", "realism"],
      "properties": {
        "allowed_genres": {
          "$ref": "#/$defs/enumList"
        },
        "adjacent_genres": {
          "$ref": "#/$defs/enumList"
        },
        "realism": {
          "enum": ["GROUNDED", "HEIGHTENED", "SPECULATIVE"]
        }
      }
    },
    "tonePolicy": {
      "type": "object",
      "additionalProperties": true,
      "required": ["primary_tones", "prohibited_tones"],
      "properties": {
        "primary_tones": {
          "$ref": "#/$defs/enumList"
        },
        "prohibited_tones": {
          "type": "array",
          "uniqueItems": true,
          "items": {
            "type": "string",
            "pattern": "^[A-Z][A-Z0-9_]*$"
          }
        }
      }
    },
    "presentationPolicy": {
      "type": "object",
      "additionalProperties": true,
      "required": ["modes", "audience_position", "information_cycle"],
      "properties": {
        "modes": {
          "$ref": "#/$defs/enumList"
        },
        "audience_position": {
          "enum": ["OBSERVER", "CO_INVESTIGATOR", "WITNESS", "CONFIDANT"]
        },
        "information_cycle": {
          "$ref": "#/$defs/enumList"
        }
      }
    },
    "audienceContract": {
      "type": "object",
      "additionalProperties": true,
      "required": ["fair_play", "promises"],
      "properties": {
        "fair_play": {
          "type": "boolean"
        },
        "promises": {
          "type": "array",
          "minItems": 1,
          "uniqueItems": true,
          "items": {
            "type": "string",
            "minLength": 1
          }
        }
      }
    },
    "storyVariationPolicy": {
      "type": "object",
      "additionalProperties": true,
      "required": ["fixed_dimensions", "variable_dimensions"],
      "properties": {
        "fixed_dimensions": {
          "$ref": "#/$defs/enumList"
        },
        "variable_dimensions": {
          "$ref": "#/$defs/enumList"
        }
      }
    },
    "narrationPolicy": {
      "type": "object",
      "additionalProperties": true,
      "required": ["enabled", "purposes"],
      "properties": {
        "enabled": {
          "type": "boolean"
        },
        "purposes": {
          "type": "array",
          "uniqueItems": true,
          "items": {
            "type": "string",
            "pattern": "^[A-Z][A-Z0-9_]*$"
          }
        },
        "repeat_visible_information": {
          "type": "boolean"
        }
      }
    },
    "reactionPolicy": {
      "type": "object",
      "additionalProperties": true,
      "required": ["enabled", "target_ratio"],
      "properties": {
        "enabled": {
          "type": "boolean"
        },
        "target_ratio": {
          "type": "object",
          "additionalProperties": false,
          "required": ["min", "max"],
          "properties": {
            "min": {
              "type": "number",
              "minimum": 0,
              "maximum": 1
            },
            "max": {
              "type": "number",
              "minimum": 0,
              "maximum": 1
            }
          }
        },
        "functions": {
          "$ref": "#/$defs/enumList"
        },
        "required_functions": {
          "$ref": "#/$defs/enumList"
        },
        "required_function_any_of": {
          "$ref": "#/$defs/enumList"
        },
        "minimum_spoken_density": {
          "type": "number",
          "minimum": 0,
          "maximum": 1
        },
        "maximum_non_speech_ratio": {
          "type": "number",
          "minimum": 0,
          "maximum": 1
        },
        "minimum_exchange_segment_ratio": {
          "type": "number",
          "minimum": 0,
          "maximum": 1
        }
      }
    },
    "crimePsychologyPolicy": {
      "type": "object",
      "additionalProperties": false,
      "required": [
        "enabled",
        "primary_genres",
        "threat_types",
        "require_psychological_pressure",
        "technical_markers",
        "max_technical_clue_ratio",
        "procedural_markers"
      ],
      "properties": {
        "enabled": {"type": "boolean"},
        "primary_genres": {"$ref": "#/$defs/enumList"},
        "threat_types": {"$ref": "#/$defs/enumList"},
        "require_psychological_pressure": {"type": "boolean"},
        "technical_markers": {
          "type": "array",
          "uniqueItems": true,
          "items": {"$ref": "#/$defs/enumName"}
        },
        "max_technical_clue_ratio": {
          "type": "number",
          "minimum": 0,
          "maximum": 1
        },
        "procedural_markers": {
          "type": "array",
          "uniqueItems": true,
          "items": {"$ref": "#/$defs/enumName"}
        }
      }
    },
    "trustAndSafetyBetrayalPolicy": {
      "type": "object",
      "additionalProperties": false,
      "required": [
        "enabled",
        "require_trusted_domain",
        "require_safe_domain_expectation"
      ],
      "properties": {
        "enabled": {"type": "boolean"},
        "require_trusted_domain": {"type": "boolean"},
        "require_safe_domain_expectation": {"type": "boolean"}
      }
    },
    "coerciveControlPolicy": {
      "type": "object",
      "additionalProperties": false,
      "required": [
        "enabled",
        "require_warning_signals",
        "require_boundary_erosion",
        "require_control_tactics",
        "require_exit_barriers"
      ],
      "properties": {
        "enabled": {"type": "boolean"},
        "require_warning_signals": {"type": "boolean"},
        "require_boundary_erosion": {"type": "boolean"},
        "require_control_tactics": {"type": "boolean"},
        "require_exit_barriers": {"type": "boolean"}
      }
    },
    "victimCenteredPolicy": {
      "type": "object",
      "additionalProperties": false,
      "required": [
        "enabled",
        "require_agency_outcome",
        "require_responsible_agent_payoff",
        "prohibited_phrases"
      ],
      "properties": {
        "enabled": {"type": "boolean"},
        "require_agency_outcome": {"type": "boolean"},
        "require_responsible_agent_payoff": {"type": "boolean"},
        "prohibited_phrases": {
          "type": "array",
          "uniqueItems": true,
          "items": {"type": "string", "minLength": 1}
        }
      }
    },
    "expertAnalysisPolicy": {
      "type": "object",
      "additionalProperties": false,
      "required": [
        "enabled",
        "true_story_requirement",
        "inspired_requirement",
        "original_requirement",
        "require_claim_evidence"
      ],
      "properties": {
        "enabled": {"type": "boolean"},
        "true_story_requirement": {"const": "REQUIRED"},
        "inspired_requirement": {
          "enum": ["REQUIRED", "REQUIRED_OR_NA"]
        },
        "original_requirement": {"const": "OPTIONAL"},
        "require_claim_evidence": {"type": "boolean"}
      }
    },
    "riskSignalAndPublicValuePolicy": {
      "type": "object",
      "additionalProperties": false,
      "required": ["enabled", "require_risk_signal_payoff"],
      "properties": {
        "enabled": {"type": "boolean"},
        "require_risk_signal_payoff": {"type": "boolean"}
      }
    },
    "sourceDisclosurePolicy": {
      "type": "object",
      "additionalProperties": false,
      "required": ["enabled", "labels_by_source_truth"],
      "properties": {
        "enabled": {"type": "boolean"},
        "labels_by_source_truth": {
          "type": "object",
          "additionalProperties": false,
          "required": [
            "ORIGINAL_FICTION",
            "VERIFIED_TRUE_CASE",
            "INSPIRED_BY_TRUE_EVENTS"
          ],
          "properties": {
            "ORIGINAL_FICTION": {"$ref": "#/$defs/sourceDisclosureLabel"},
            "VERIFIED_TRUE_CASE": {"$ref": "#/$defs/sourceDisclosureLabel"},
            "INSPIRED_BY_TRUE_EVENTS": {"$ref": "#/$defs/sourceDisclosureLabel"}
          }
        }
      }
    },
    "clinicalLabelPolicy": {
      "type": "object",
      "additionalProperties": false,
      "required": [
        "enabled",
        "controlled_terms",
        "allowed_classifications",
        "diagnosis_requires_expert",
        "diagnosis_requires_evidence"
      ],
      "properties": {
        "enabled": {"type": "boolean"},
        "controlled_terms": {
          "type": "array",
          "uniqueItems": true,
          "items": {"type": "string", "minLength": 1}
        },
        "allowed_classifications": {
          "type": "array",
          "minItems": 1,
          "uniqueItems": true,
          "items": {"$ref": "#/$defs/clinicalLabelClassification"}
        },
        "diagnosis_requires_expert": {"type": "boolean"},
        "diagnosis_requires_evidence": {"type": "boolean"}
      }
    },
    "episodeThemePolicy": {
      "type": "object",
      "additionalProperties": false,
      "required": ["enabled", "allowed_themes", "require_episode_theme"],
      "properties": {
        "enabled": {"type": "boolean"},
        "allowed_themes": {"$ref": "#/$defs/enumList"},
        "require_episode_theme": {"type": "boolean"}
      }
    },
    "sceneRealizationPolicy": {
      "type": "object",
      "additionalProperties": false,
      "required": [
        "enabled",
        "required_stages",
        "critical_stages",
        "minimum_distinct_drama_scenes",
        "maximum_stages_per_scene",
        "minimum_psychology_drama_ratio",
        "minimum_pre_harm_drama_ratio",
        "drama_realization_required",
        "narration_only_satisfaction",
        "panel_only_satisfaction",
        "minimum_realization_score"
      ],
      "properties": {
        "enabled": {"type": "boolean"},
        "required_stages": {
          "type": "array",
          "prefixItems": [
            {"const": "TRUST_FORMATION"},
            {"const": "EARLY_WARNING"},
            {"const": "RATIONALIZATION"},
            {"const": "BOUNDARY_EROSION"},
            {"const": "CONTROL_OR_DEPENDENCY"},
            {"const": "PSYCHOLOGICAL_CONSEQUENCE"},
            {"const": "HARM_OR_CRIME"},
            {"const": "RECOGNITION_AND_RESISTANCE"},
            {"const": "AGENCY_RECOVERY"}
          ],
          "items": false,
          "minItems": 9,
          "maxItems": 9
        },
        "critical_stages": {
          "type": "array",
          "minItems": 1,
          "uniqueItems": true,
          "items": {"$ref": "#/$defs/psychologicalStageType"}
        },
        "minimum_distinct_drama_scenes": {
          "type": "integer",
          "minimum": 1
        },
        "maximum_stages_per_scene": {
          "type": "integer",
          "minimum": 1
        },
        "minimum_psychology_drama_ratio": {
          "type": "number",
          "minimum": 0,
          "maximum": 1
        },
        "minimum_pre_harm_drama_ratio": {
          "type": "number",
          "minimum": 0,
          "maximum": 1
        },
        "drama_realization_required": {"const": true},
        "narration_only_satisfaction": {"const": false},
        "panel_only_satisfaction": {"const": false},
        "minimum_realization_score": {
          "type": "number",
          "minimum": 85,
          "maximum": 100
        }
      }
    },
    "explicitCrimeEventPolicy": {
      "type": "object",
      "additionalProperties": false,
      "required": [
        "enabled",
        "core_crimes",
        "require_central_event",
        "allow_overlapping_crimes",
        "method_detail_level",
        "required_reveal_targets",
        "development_functions_by_family",
        "nonlinear_development_allowed",
        "require_survival",
        "require_direct_reporting",
        "require_forgiveness",
        "require_recovery"
      ],
      "properties": {
        "enabled": {"type": "boolean"},
        "core_crimes": {
          "type": "array",
          "minItems": 8,
          "maxItems": 8,
          "uniqueItems": true,
          "items": {"$ref": "#/$defs/explicitCrimeType"}
        },
        "require_central_event": {"type": "boolean"},
        "allow_overlapping_crimes": {"type": "boolean"},
        "method_detail_level": {"const": "NON_ACTIONABLE_SUMMARY_ONLY"},
        "required_reveal_targets": {
          "type": "array",
          "minItems": 4,
          "maxItems": 4,
          "uniqueItems": true,
          "items": {"enum": ["CULPRIT", "MOTIVE", "METHOD", "HARM_RESULT"]}
        },
        "development_functions_by_family": {
          "type": "object",
          "additionalProperties": false,
          "required": ["MURDER", "LIBERTY_CRIME", "RELATIONAL_VIOLENCE", "ACCESS_CRIME"],
          "properties": {
            "MURDER": {"$ref": "#/$defs/developmentFunctionList"},
            "LIBERTY_CRIME": {"$ref": "#/$defs/developmentFunctionList"},
            "RELATIONAL_VIOLENCE": {"$ref": "#/$defs/developmentFunctionList"},
            "ACCESS_CRIME": {"$ref": "#/$defs/developmentFunctionList"}
          }
        },
        "nonlinear_development_allowed": {"type": "boolean"},
        "require_survival": {"type": "boolean"},
        "require_direct_reporting": {"type": "boolean"},
        "require_forgiveness": {"type": "boolean"},
        "require_recovery": {"type": "boolean"}
      }
    },
    "explicitCrimeType": {
      "enum": [
        "MURDER",
        "KIDNAPPING",
        "CONFINEMENT",
        "ASSAULT",
        "STALKING",
        "HOME_INVASION",
        "DATING_VIOLENCE",
        "DOMESTIC_VIOLENCE"
      ]
    },
    "developmentFunctionList": {
      "type": "array",
      "minItems": 4,
      "uniqueItems": true,
      "items": {"type": "string", "pattern": "^[A-Z][A-Z0-9_]*$"}
    },
    "enumName": {
      "type": "string",
      "pattern": "^[A-Z][A-Z0-9_]*$"
    },
    "sourceDisclosureLabel": {
      "enum": [
        "VERIFIED_TRUE_CASE",
        "INSPIRED_BY_TRUE_EVENTS",
        "ORIGINAL_FICTION"
      ]
    },
    "clinicalLabelClassification": {
      "enum": [
        "CONFIRMED_DIAGNOSIS",
        "EXPERT_ASSESSMENT",
        "MEDIA_DESCRIPTION",
        "NARRATOR_OPINION",
        "UNVERIFIED_LABEL"
      ]
    },
    "psychologicalStageType": {
      "enum": [
        "TRUST_FORMATION",
        "EARLY_WARNING",
        "RATIONALIZATION",
        "BOUNDARY_EROSION",
        "CONTROL_OR_DEPENDENCY",
        "PSYCHOLOGICAL_CONSEQUENCE",
        "HARM_OR_CRIME",
        "RECOGNITION_AND_RESISTANCE",
        "AGENCY_RECOVERY"
      ]
    },
    "genericPolicy": {
      "type": "object"
    }
  }
}
